{
  "$schema": "https://json-schema.org/draft/2020-12/schema",
  "$id": "https://minnow.local/schemas/tool-plugin.json",
  "title": "Minnow native tool plugin manifest",
  "type": "object",
  "required": ["id", "functionName", "label", "description", "category", "parameters"],
  "additionalProperties": false,
  "properties": {
    "id": {
      "type": "string",
      "pattern": "^[a-z0-9][a-z0-9-]*$",
      "description": "Must match parent folder name under ~/.minnow/tools/"
    },
    "functionName": {
      "type": "string",
      "pattern": "^[a-z][a-z0-9_]*$",
      "description": "Exposed as plugin__<id>__<functionName> (hyphens in id become underscores)"
    },
    "label": { "type": "string", "minLength": 1 },
    "description": { "type": "string", "minLength": 1 },
    "category": {
      "type": "string",
      "enum": ["web", "utility", "files", "git", "code", "agents", "browser", "lsp"]
    },
    "parameters": {
      "type": "object",
      "required": ["type", "properties"],
      "properties": {
        "type": { "const": "object" },
        "properties": { "type": "object" },
        "required": { "type": "array", "items": { "type": "string" } }
      }
    },
    "capabilities": {
      "type": "object",
      "properties": {
        "filesystem": { "type": "boolean" },
        "network": { "type": "boolean" },
        "nodeBuiltin": { "type": "boolean" }
      },
      "additionalProperties": false
    }
  }
}
